{"algorithm":"ed25519","authority_hash":"sha256:8e48d29edc2a44c345e26bc5e2a01430cfff266198309ba6f5468b0b607b0ea3","authority_id":"spiffe://helm/connector-release-authority","certification_authority":"spiffe://helm/certification-review-authority","certification_hash":"sha256:cccccccccccccccccccccccccccccccccccccccccccccccccccccccccccccccc","certification_ref":"cert://connector-a/1.0.0","connector_binary_hash":"sha256:aaaaaaaaaaaaaaaaaaaaaaaaaaaaaaaaaaaaaaaaaaaaaaaaaaaaaaaaaaaaaaaa","connector_drift_policy_ref":"policy://connector-drift/v1","connector_executor_kind":"digital","connector_id":"connector-a","connector_sandbox_profile":"sandbox-pack-lifecycle-v1","connector_signature_hash":"sha256:bbbbbbbbbbbbbbbbbbbbbbbbbbbbbbbbbbbbbbbbbbbbbbbbbbbbbbbbbbbbbbbb","connector_signature_ref":"sigstore://connector-a/1.0.0","connector_signer_id":"publisher-a","connector_version":"1.0.0","contract_version":"2026-07-17","previous_authority_hash":"sha256:1c012d65fa02bee2aa09b4b187f60672ba85ea967be6e9701e6e13ce911be19b","registry_revision":2,"revokes_authority_hash":"sha256:1c012d65fa02bee2aa09b4b187f60672ba85ea967be6e9701e6e13ce911be19b","schema_version":"connector-release-authority.v1","scope_kind":"global","signed_at":"2026-07-17T12:01:00Z","signing_key_ref":"kms://helm/connector-release-authority/key-a","state":"revoked","valid_from":"2026-07-17T12:01:00Z"}
